{
  "schemaVersion": "1.0.0",
  "project": {
    "id": "lakeside-barn-residence",
    "name": "Lakeside Barn Residence Study",
    "status": "selected-concept",
    "description": "Synthetic two-level workshop and residence used to test cross-view concept consistency.",
    "coordinates": {
      "unit": "mm",
      "origin": { "x": 0, "y": 0, "z": 0 },
      "siteDatumMm": 0,
      "trueNorthDeg": 18,
      "toleranceMm": 3,
      "displayUnits": "feet-inches"
    },
    "jurisdiction": {
      "country": "US",
      "stateOrRegion": "New York",
      "county": "Example County",
      "locality": "Example Township",
      "codeReviewStatus": "needs-review"
    }
  },
  "levels": [
    {
      "id": "level-ground",
      "name": "Ground Floor",
      "elevationMm": 0,
      "floorToFloorMm": 3900,
      "evidence": {
        "source": "generated",
        "confidence": 1,
        "status": "accepted",
        "note": "Synthetic fixture datum."
      }
    },
    {
      "id": "level-upper",
      "name": "Upper Floor",
      "elevationMm": 3900,
      "floorToFloorMm": 3100,
      "evidence": {
        "source": "generated",
        "confidence": 1,
        "status": "accepted",
        "note": "Synthetic fixture datum."
      }
    }
  ],
  "spaces": [
    {
      "id": "space-workshop",
      "name": "Workshop",
      "levelId": "level-ground",
      "use": "vehicle and fabrication workshop",
      "occupancy": 4,
      "boundary": [
        { "x": 0, "y": 0 },
        { "x": 9600, "y": 0 },
        { "x": 9600, "y": 9000 },
        { "x": 0, "y": 9000 }
      ],
      "evidence": {
        "source": "generated",
        "confidence": 1,
        "status": "accepted",
        "note": "Synthetic regression room."
      }
    },
    {
      "id": "space-utility",
      "name": "Utility Core",
      "levelId": "level-ground",
      "use": "utility, washroom, and vertical services",
      "occupancy": 1,
      "boundary": [
        { "x": 0, "y": 9000 },
        { "x": 3600, "y": 9000 },
        { "x": 3600, "y": 13200 },
        { "x": 0, "y": 13200 }
      ],
      "evidence": {
        "source": "generated",
        "confidence": 1,
        "status": "accepted",
        "note": "Synthetic wet and equipment core."
      }
    },
    {
      "id": "space-entry-stair",
      "name": "Entry and Stair",
      "levelId": "level-ground",
      "use": "entry, storage, and vertical circulation",
      "occupancy": 3,
      "boundary": [
        { "x": 3600, "y": 9000 },
        { "x": 9600, "y": 9000 },
        { "x": 9600, "y": 13200 },
        { "x": 3600, "y": 13200 }
      ],
      "evidence": {
        "source": "generated",
        "confidence": 1,
        "status": "accepted",
        "note": "Synthetic circulation zone."
      }
    },
    {
      "id": "space-great-room",
      "name": "Great Room and Kitchen",
      "levelId": "level-upper",
      "use": "living, dining, and kitchen",
      "occupancy": 8,
      "boundary": [
        { "x": 0, "y": 0 },
        { "x": 9600, "y": 0 },
        { "x": 9600, "y": 7600 },
        { "x": 0, "y": 7600 }
      ],
      "evidence": {
        "source": "generated",
        "confidence": 1,
        "status": "accepted",
        "note": "Synthetic open living zone."
      }
    },
    {
      "id": "space-bedroom",
      "name": "Bedroom",
      "levelId": "level-upper",
      "use": "sleeping",
      "occupancy": 2,
      "boundary": [
        { "x": 0, "y": 7600 },
        { "x": 4800, "y": 7600 },
        { "x": 4800, "y": 13200 },
        { "x": 0, "y": 13200 }
      ],
      "evidence": {
        "source": "generated",
        "confidence": 1,
        "status": "accepted",
        "note": "Synthetic sleeping zone."
      }
    },
    {
      "id": "space-bath",
      "name": "Bath and Laundry",
      "levelId": "level-upper",
      "use": "bathroom and laundry",
      "occupancy": 2,
      "boundary": [
        { "x": 4800, "y": 7600 },
        { "x": 9600, "y": 7600 },
        { "x": 9600, "y": 13200 },
        { "x": 4800, "y": 13200 }
      ],
      "evidence": {
        "source": "generated",
        "confidence": 1,
        "status": "accepted",
        "note": "Synthetic upper wet zone aligned near the utility core."
      }
    }
  ],
  "walls": [
    {
      "id": "wall-g-north",
      "levelId": "level-ground",
      "start": { "x": 0, "y": 0 },
      "end": { "x": 9600, "y": 0 },
      "thicknessMm": 200,
      "heightMm": 3700,
      "kind": "exterior",
      "material": "insulated post-frame wall",
      "evidence": { "source": "generated", "confidence": 1, "status": "accepted", "note": "Synthetic exterior wall." }
    },
    {
      "id": "wall-g-east",
      "levelId": "level-ground",
      "start": { "x": 9600, "y": 0 },
      "end": { "x": 9600, "y": 13200 },
      "thicknessMm": 200,
      "heightMm": 3700,
      "kind": "exterior",
      "material": "insulated post-frame wall",
      "evidence": { "source": "generated", "confidence": 1, "status": "accepted", "note": "Synthetic exterior wall." }
    },
    {
      "id": "wall-g-south",
      "levelId": "level-ground",
      "start": { "x": 9600, "y": 13200 },
      "end": { "x": 0, "y": 13200 },
      "thicknessMm": 200,
      "heightMm": 3700,
      "kind": "exterior",
      "material": "insulated post-frame wall",
      "evidence": { "source": "generated", "confidence": 1, "status": "accepted", "note": "Synthetic exterior wall." }
    },
    {
      "id": "wall-g-west",
      "levelId": "level-ground",
      "start": { "x": 0, "y": 13200 },
      "end": { "x": 0, "y": 0 },
      "thicknessMm": 200,
      "heightMm": 3700,
      "kind": "exterior",
      "material": "insulated post-frame wall",
      "evidence": { "source": "generated", "confidence": 1, "status": "accepted", "note": "Synthetic exterior wall." }
    },
    {
      "id": "wall-g-core",
      "levelId": "level-ground",
      "start": { "x": 0, "y": 9000 },
      "end": { "x": 9600, "y": 9000 },
      "thicknessMm": 140,
      "heightMm": 3000,
      "kind": "interior",
      "material": "wood stud partition",
      "evidence": { "source": "generated", "confidence": 1, "status": "accepted", "note": "Synthetic service-core partition." }
    },
    {
      "id": "wall-g-entry",
      "levelId": "level-ground",
      "start": { "x": 3600, "y": 9000 },
      "end": { "x": 3600, "y": 13200 },
      "thicknessMm": 140,
      "heightMm": 3000,
      "kind": "interior",
      "material": "wood stud partition",
      "evidence": { "source": "generated", "confidence": 1, "status": "accepted", "note": "Synthetic utility partition." }
    },
    {
      "id": "wall-u-north",
      "levelId": "level-upper",
      "start": { "x": 0, "y": 0 },
      "end": { "x": 9600, "y": 0 },
      "thicknessMm": 200,
      "heightMm": 3000,
      "kind": "exterior",
      "material": "insulated framed wall",
      "evidence": { "source": "generated", "confidence": 1, "status": "accepted", "note": "Synthetic upper exterior wall." }
    },
    {
      "id": "wall-u-east",
      "levelId": "level-upper",
      "start": { "x": 9600, "y": 0 },
      "end": { "x": 9600, "y": 13200 },
      "thicknessMm": 200,
      "heightMm": 3000,
      "kind": "exterior",
      "material": "insulated framed wall",
      "evidence": { "source": "generated", "confidence": 1, "status": "accepted", "note": "Synthetic upper exterior wall." }
    },
    {
      "id": "wall-u-south",
      "levelId": "level-upper",
      "start": { "x": 9600, "y": 13200 },
      "end": { "x": 0, "y": 13200 },
      "thicknessMm": 200,
      "heightMm": 3000,
      "kind": "exterior",
      "material": "insulated framed wall",
      "evidence": { "source": "generated", "confidence": 1, "status": "accepted", "note": "Synthetic upper exterior wall." }
    },
    {
      "id": "wall-u-west",
      "levelId": "level-upper",
      "start": { "x": 0, "y": 13200 },
      "end": { "x": 0, "y": 0 },
      "thicknessMm": 200,
      "heightMm": 3000,
      "kind": "exterior",
      "material": "insulated framed wall",
      "evidence": { "source": "generated", "confidence": 1, "status": "accepted", "note": "Synthetic upper exterior wall." }
    },
    {
      "id": "wall-u-bedrooms",
      "levelId": "level-upper",
      "start": { "x": 0, "y": 7600 },
      "end": { "x": 9600, "y": 7600 },
      "thicknessMm": 140,
      "heightMm": 2800,
      "kind": "interior",
      "material": "wood stud partition",
      "evidence": { "source": "generated", "confidence": 1, "status": "accepted", "note": "Synthetic private-zone partition." }
    },
    {
      "id": "wall-u-bath",
      "levelId": "level-upper",
      "start": { "x": 4800, "y": 7600 },
      "end": { "x": 4800, "y": 13200 },
      "thicknessMm": 140,
      "heightMm": 2800,
      "kind": "interior",
      "material": "wood stud partition",
      "evidence": { "source": "generated", "confidence": 1, "status": "accepted", "note": "Synthetic bath partition." }
    }
  ],
  "openings": [
    {
      "id": "opening-overhead-west",
      "wallId": "wall-g-north",
      "kind": "overhead-door",
      "offsetMm": 700,
      "widthMm": 3200,
      "heightMm": 3000,
      "sillMm": 0,
      "swing": "none",
      "evidence": { "source": "generated", "confidence": 1, "status": "accepted", "note": "Synthetic workshop opening." }
    },
    {
      "id": "opening-overhead-east",
      "wallId": "wall-g-north",
      "kind": "overhead-door",
      "offsetMm": 5000,
      "widthMm": 3200,
      "heightMm": 3000,
      "sillMm": 0,
      "swing": "none",
      "evidence": { "source": "generated", "confidence": 1, "status": "accepted", "note": "Synthetic workshop opening." }
    },
    {
      "id": "opening-entry",
      "wallId": "wall-g-east",
      "kind": "door",
      "offsetMm": 10300,
      "widthMm": 1000,
      "heightMm": 2100,
      "sillMm": 0,
      "swing": "left",